{
  "run_id": "synthetic:2026-W45:week",
  "proposal_id": "synthetic-go-live-1",
  "decision": "approved",
  "decided_at": "2026-11-01T10:00:00-05:00",
  "slots": {
    "notes-1": "52aa199f170d46c6da17357c147ac4f012deffceda7d423ed36ff54882368860",
    "threads-1": "a05e310dbcfa7564d9f3b1137d1219ff1062e39c258fb7b20991b278d172a98d",
    "ig-story-1": "ace13cd7ff23a75ff5a4309e1ae7ef2122ec1f6cf89aac3871b01ad73c7337d7",
    "tiktok-photo-1": "a0bdc7e1e11218cef9b89241679e23257856596ad1f8e6f0cfc9a88f2fd9c82d",
    "linkedin-1": "14d5e9a01fe019457aae4074577fc6b29405a3af603f9de63a9a6e32c594b90f",
    "x-1": "07236a34c2b15bdf91f7fd616a382db73afcb576f98741af5b88a5610e498161"
  }
}
